{
  "paper_url": "",
  "paper_title": "",
  "target_metrics": [],
  "phase": "init",
  "gates": {
    "gate_0_paper_audit": {
      "status": "pending",
      "timestamp": "",
      "evidence": "",
      "failure_reasons": []
    },
    "gate_1_preflight": {
      "status": "pending",
      "timestamp": "",
      "evidence": "",
      "failure_reasons": []
    },
    "gate_2_short_loop": {
      "status": "pending",
      "timestamp": "",
      "evidence": "",
      "failure_reasons": [],
      "details": {
        "l0_smoke": "pending",
        "l1_overfit": "pending",
        "l2_mini_loop": "pending",
        "l3_checkpoint_resume": "pending"
      }
    },
    "gate_3_parity": {
      "status": "pending",
      "timestamp": "",
      "evidence": "",
      "failure_reasons": [],
      "parity_results": {
        "amp_parity": "not_tested",
        "ddp_parity": "not_tested",
        "batch_size_parity": "not_tested"
      }
    },
    "gate_4_full_training": {
      "status": "pending",
      "timestamp": "",
      "evidence": "",
      "failure_reasons": []
    },
    "gate_5_evidence": {
      "status": "pending",
      "timestamp": "",
      "evidence": "",
      "failure_reasons": []
    }
  },
  "current_mode": "strict_repro",
  "project_mode": "diagnose",
  "mode_switches": [
    {
      "timestamp": "2026-07-15T21:06:42.822397+00:00",
      "from": "reproduce",
      "to": "diagnose",
      "reason": "contract signed"
    }
  ],
  "flags": {
    "AUTO_PROCEED": false,
    "HUMAN_CHECKPOINT": true,
    "EXTERNAL_REVIEW": false,
    "REVIEW_DIFFICULTY": "hard",
    "COMPUTE_BUDGET_GPU_HOURS": null,
    "STORAGE_BUDGET_GB": null
  },
  "repositories": {
    "primary": {
      "url": "",
      "commit": "",
      "role": "primary",
      "local_path": ""
    },
    "references": []
  },
  "runs": [],
  "hardware": {}
}